{
  "version": "0.18.0",
  "generated": "2026-10-11",
  "plays_snapshot": "2026-10-11",
  "method": "Per-family deep dives computed from api/v1/codex.json against api/v1/eras.json, data/sessions.json, api/v1/session-clusters.json, api/v1/circle.json, and api/v1/release-slugs.json. Decoded readings are traced verbatim to codex.json's epithets; where the archive assigns no meaning (the litemode/nitemode words) the reading is stated as unknown. No meanings invented.",
  "family_count": 16,
  "families": [
    {
      "name": "The Modes",
      "slug": "the-modes",
      "epithet": "The mode-words. Five transmissions carry them - lite, nite, and night.",
      "words": [
        "litemode",
        "nitemode",
        "night mode"
      ],
      "page": "codex/the-modes.html",
      "track_count": 5,
      "total_plays": 10864,
      "decoded": {
        "reading": "The archive assigns no meaning to the mode-words. litemode / nitemode appear in titles, but no index source defines them for this artist or collective - tallied, never translated. (method.html unknowns register, re-checked 2026-10-11.)",
        "status": "unknown",
        "source": "method.html unknowns register (2026-10-11)"
      },
      "first_appearance": {
        "title": "NIGHT MODE ft. MAX FERRARI x YUNG VETTA x JAX",
        "date": "2019-07-09",
        "plays": 10083,
        "page": "releases/night-mode-ft-max-ferrari-x-yung-vetta-x-jax.html"
      },
      "latest": {
        "title": "big litemode (prod runawway, ilyagargod & k3nik)",
        "date": "2025-11-23",
        "plays": 455,
        "page": "releases/big-litemode-prod-runawway-ilyagargod-and-k3nik.html"
      },
      "eras": [
        {
          "id": "the-first-rite",
          "name": "The First Rite",
          "span": "2017 – 2019",
          "transmissions": 1,
          "plays": 10083,
          "loudest": {
            "title": "NIGHT MODE ft. MAX FERRARI x YUNG VETTA x JAX",
            "date": "2019-07-09",
            "plays": 10083,
            "page": "releases/night-mode-ft-max-ferrari-x-yung-vetta-x-jax.html"
          },
          "deep_dive": "eras/the-first-rite.html",
          "journey": "transmission.html#era-the-first-rite"
        },
        {
          "id": "the-somelowlifes-era",
          "name": "The SomeLowLifes Era",
          "span": "2023 – 2024",
          "transmissions": 3,
          "plays": 326,
          "loudest": {
            "title": "3 Points Pre Game prod. doublemulti x pinkcat #NITEMODE",
            "date": "2024-05-28",
            "plays": 170,
            "page": "releases/3-points-pre-game-prod-doublemulti-x-pinkcat-nitemode.html"
          },
          "deep_dive": "eras/the-somelowlifes-era.html",
          "journey": "transmission.html#era-the-somelowlifes-era"
        },
        {
          "id": "the-silence",
          "name": "The Silence",
          "span": "2025",
          "transmissions": 1,
          "plays": 455,
          "loudest": {
            "title": "big litemode (prod runawway, ilyagargod & k3nik)",
            "date": "2025-11-23",
            "plays": 455,
            "page": "releases/big-litemode-prod-runawway-ilyagargod-and-k3nik.html"
          },
          "deep_dive": "eras/the-silence.html",
          "journey": "transmission.html#era-the-silence"
        }
      ],
      "transmissions": [
        {
          "title": "NIGHT MODE ft. MAX FERRARI x YUNG VETTA x JAX",
          "date": "2019-07-09",
          "plays": 10083,
          "type": "SoundCloud-only",
          "page": "releases/night-mode-ft-max-ferrari-x-yung-vetta-x-jax.html"
        },
        {
          "title": "u Not at the Table (Sunsetzer0) #litemode",
          "date": "2024-04-18",
          "plays": 139,
          "type": "SoundCloud-only",
          "page": "releases/u-not-at-the-table-sunsetzer0-litemode.html"
        },
        {
          "title": "3 Points Pre Game prod. doublemulti x pinkcat #NITEMODE",
          "date": "2024-05-28",
          "plays": 170,
          "type": "SoundCloud-only",
          "page": "releases/3-points-pre-game-prod-doublemulti-x-pinkcat-nitemode.html"
        },
        {
          "title": "nitemode2019 w/ Max+Vetty prod. NaXi.wav",
          "date": "2024-11-05",
          "plays": 17,
          "type": "SoundCloud-only",
          "page": "releases/nitemode2019-w-max-vetty-prod-naxi-wav.html"
        },
        {
          "title": "big litemode (prod runawway, ilyagargod & k3nik)",
          "date": "2025-11-23",
          "plays": 455,
          "type": "SoundCloud-only",
          "page": "releases/big-litemode-prod-runawway-ilyagargod-and-k3nik.html"
        }
      ],
      "key_sessions": [
        {
          "id": "session-24",
          "name": "The July 9th Session",
          "start": "2019-07-09",
          "end": "2019-07-09",
          "family_transmissions": 1,
          "family_plays": 10083,
          "deep_dive": "sessions/the-july-9th-session.html",
          "page": "sessions/the-july-9th-session.html"
        },
        {
          "id": "session-56",
          "name": "The November 23rd Session",
          "start": "2025-11-23",
          "end": "2025-11-23",
          "family_transmissions": 1,
          "family_plays": 455,
          "deep_dive": null,
          "page": "sessions.html"
        },
        {
          "id": "session-45",
          "name": "The May 22nd–31st Session",
          "start": "2024-05-22",
          "end": "2024-05-31",
          "family_transmissions": 1,
          "family_plays": 170,
          "deep_dive": null,
          "page": "sessions.html"
        },
        {
          "id": "session-43",
          "name": "The April 16th–18th Session",
          "start": "2024-04-16",
          "end": "2024-04-18",
          "family_transmissions": 1,
          "family_plays": 139,
          "deep_dive": null,
          "page": "sessions.html"
        },
        {
          "id": "session-52",
          "name": "The November 5th Session",
          "start": "2024-11-05",
          "end": "2024-11-05",
          "family_transmissions": 1,
          "family_plays": 17,
          "deep_dive": null,
          "page": "sessions.html"
        }
      ],
      "collaborators": [
        {
          "slug": "jax",
          "name": "JAX",
          "page": "circle/jax.html",
          "transmissions": 1,
          "plays": 10083
        },
        {
          "slug": "max-ferrari",
          "name": "Max Ferrari",
          "page": "circle/max-ferrari.html",
          "transmissions": 1,
          "plays": 10083
        },
        {
          "slug": "yung-vetta",
          "name": "Yung Vetta",
          "page": "circle/yung-vetta.html",
          "transmissions": 1,
          "plays": 10083
        },
        {
          "slug": "max",
          "name": "Max",
          "page": "circle/max.html",
          "transmissions": 1,
          "plays": 17
        },
        {
          "slug": "vetty",
          "name": "Vetty",
          "page": "circle/vetty.html",
          "transmissions": 1,
          "plays": 17
        }
      ],
      "producers": [
        {
          "name": "ilyagargod",
          "page": "producers/ilyagargod.html",
          "transmissions": 1,
          "plays": 455
        },
        {
          "name": "k3nik",
          "page": "producers/k3nik.html",
          "transmissions": 1,
          "plays": 455
        },
        {
          "name": "runawway",
          "page": "producers/runawway.html",
          "transmissions": 1,
          "plays": 455
        },
        {
          "name": "doublemulti",
          "page": "producers/doublemulti.html",
          "transmissions": 1,
          "plays": 170
        },
        {
          "name": "pinkcat",
          "page": "producers/pinkcat.html",
          "transmissions": 1,
          "plays": 170
        },
        {
          "name": "NaXi",
          "page": "producers/naxi.html",
          "transmissions": 1,
          "plays": 17
        }
      ]
    },
    {
      "name": "The Castings",
      "slug": "the-castings",
      "epithet": "Five transmissions bear the word cast - the central verb of the catalog.",
      "words": [
        "cast"
      ],
      "page": "codex/the-castings.html",
      "track_count": 5,
      "total_plays": 693,
      "decoded": {
        "reading": "Five transmissions bear the word cast - the central verb of the catalog.",
        "status": "stated",
        "source": "codex.json epithet - the archive's own reading of this word family (site framing of title vocabulary, not an artist statement)"
      },
      "first_appearance": {
        "title": "Cast It:, Pt. 1",
        "date": "2021-07-14",
        "plays": null,
        "page": "releases/cast-it-pt-1.html"
      },
      "latest": {
        "title": "Cast OUT!!!",
        "date": "2023-11-12",
        "plays": 481,
        "page": "releases/cast-out-2.html"
      },
      "eras": [
        {
          "id": "the-cast-it-years",
          "name": "The Cast It: Years",
          "span": "2021 – 2022",
          "transmissions": 3,
          "plays": 212,
          "loudest": {
            "title": "I Can't Get Myself to Cast (prod. lil biscuit)",
            "date": "2021-07-14",
            "plays": 212,
            "page": "releases/i-can-t-get-myself-to-cast-prod-lil-biscuit.html"
          },
          "deep_dive": "eras/the-cast-it-years.html",
          "journey": "transmission.html#era-the-cast-it-years"
        },
        {
          "id": "the-somelowlifes-era",
          "name": "The SomeLowLifes Era",
          "span": "2023 – 2024",
          "transmissions": 2,
          "plays": 481,
          "loudest": {
            "title": "Cast OUT!!!",
            "date": "2023-11-12",
            "plays": 481,
            "page": "releases/cast-out-2.html"
          },
          "deep_dive": "eras/the-somelowlifes-era.html",